{
  "schemaVersion": "0.9.2",
  "project": {
    "id": "project-nexus-ai",
    "name": "Nexus AI",
    "description": "An AI continuity workspace that keeps complex projects understandable, trustworthy, and actionable.",
    "status": "in_progress",
    "createdAt": "2026-07-24T00:00:00Z",
    "updatedAt": "2026-07-30T00:00:00Z"
  },
  "entities": [
    {
      "id": "owner-product",
      "type": "owner",
      "title": "Product stewardship",
      "summary": "Human authority for product direction and scenario approval.",
      "status": "confirmed",
      "createdAt": "2026-07-24T00:00:00Z",
      "updatedAt": "2026-07-30T00:00:00Z",
      "source": {
        "provider": "nexus",
        "reference": "project-governance"
      },
      "confidence": 1,
      "metadata": {
        "role": "product"
      }
    },
    {
      "id": "owner-engineering",
      "type": "owner",
      "title": "Engineering stewardship",
      "summary": "Implementation authority for validated technical work.",
      "status": "confirmed",
      "createdAt": "2026-07-24T00:00:00Z",
      "updatedAt": "2026-07-30T00:00:00Z",
      "source": {
        "provider": "nexus",
        "reference": "project-governance"
      },
      "confidence": 1,
      "metadata": {
        "role": "engineering"
      }
    },
    {
      "id": "source-datahub-integration",
      "type": "source",
      "title": "DataHub integration documentation",
      "summary": "Repository documentation defining the DataHub boundary and verified development fixture.",
      "status": "confirmed",
      "createdAt": "2026-07-29T00:00:00Z",
      "updatedAt": "2026-07-30T00:00:00Z",
      "source": {
        "provider": "github",
        "reference": "docs/Nexus-DataHub-Integration.md"
      },
      "confidence": 1,
      "metadata": {
        "documentType": "technical-boundary"
      }
    },
    {
      "id": "source-runtime-record",
      "type": "source",
      "title": "Runtime verification record",
      "summary": "Recorded DataHub Core and read-only MCP verification evidence.",
      "status": "confirmed",
      "createdAt": "2026-07-29T00:00:00Z",
      "updatedAt": "2026-07-30T00:00:00Z",
      "source": {
        "provider": "github",
        "reference": "datahub/runtime/README.md"
      },
      "confidence": 1,
      "metadata": {
        "documentType": "runtime-evidence"
      }
    },
    {
      "id": "source-star-map-experiment",
      "type": "source",
      "title": "Star Map design experiment",
      "summary": "Historical visual experiment retained for design history but removed from the primary experience.",
      "status": "archived",
      "createdAt": "2026-07-27T00:00:00Z",
      "updatedAt": "2026-07-30T00:00:00Z",
      "source": {
        "provider": "github",
        "reference": "docs/Nexus-Star-Map-Design.md"
      },
      "confidence": 1,
      "metadata": {
        "archivedVisualExperiment": true,
        "primaryExperience": false
      }
    },
    {
      "id": "source-editorial-exploration",
      "type": "source",
      "title": "Editorial design exploration",
      "summary": "Approved Editorial Atlas and Signal Instrument design direction.",
      "status": "confirmed",
      "createdAt": "2026-07-30T00:00:00Z",
      "updatedAt": "2026-07-30T00:00:00Z",
      "source": {
        "provider": "local_file",
        "reference": "approved-design-direction"
      },
      "confidence": 1,
      "metadata": {
        "designDirection": "Editorial Atlas × Signal Instrument"
      }
    },
    {
      "id": "evidence-runtime-pass",
      "type": "evidence",
      "title": "DataHub runtime verification passed",
      "summary": "DataHub Core v1.5.0.6 verified seven fixture entities and five relationships.",
      "status": "confirmed",
      "createdAt": "2026-07-29T00:00:00Z",
      "updatedAt": "2026-07-30T00:00:00Z",
      "source": {
        "provider": "runtime_record",
        "reference": "runtime-pass"
      },
      "ownerId": "owner-engineering",
      "confidence": 1,
      "metadata": {
        "result": "PASS"
      },
      "confirmedBy": "owner-engineering",
      "confirmedAt": "2026-07-30T00:00:00Z"
    },
    {
      "id": "evidence-mcp-pass",
      "type": "evidence",
      "title": "MCP read-only smoke test passed",
      "summary": "The official Python MCP server completed search, entity, and lineage reads with mutation disabled.",
      "status": "confirmed",
      "createdAt": "2026-07-30T00:00:00Z",
      "updatedAt": "2026-07-30T00:00:00Z",
      "source": {
        "provider": "runtime_record",
        "reference": "mcp-read-only-pass"
      },
      "ownerId": "owner-engineering",
      "confidence": 1,
      "metadata": {
        "result": "PASS",
        "mutationEnabled": false
      },
      "confirmedBy": "owner-engineering",
      "confirmedAt": "2026-07-30T00:00:00Z"
    },
    {
      "id": "evidence-campus-rejected",
      "type": "evidence",
      "title": "Campus fixture rejected for final Demo",
      "summary": "The campus low-carbon scenario remains a development fixture and is not the final public showcase.",
      "status": "confirmed",
      "createdAt": "2026-07-30T00:00:00Z",
      "updatedAt": "2026-07-30T00:00:00Z",
      "source": {
        "provider": "user_decision",
        "reference": "fixture-boundary"
      },
      "ownerId": "owner-product",
      "confidence": 1,
      "metadata": {
        "finalDemo": false,
        "developmentFixture": true
      },
      "confirmedBy": "owner-product",
      "confirmedAt": "2026-07-30T00:00:00Z"
    },
    {
      "id": "evidence-star-map-archived",
      "type": "evidence",
      "title": "Star Map removed from primary experience",
      "summary": "The visual experiment is retained in history but excluded from the new primary product flow.",
      "status": "confirmed",
      "createdAt": "2026-07-30T00:00:00Z",
      "updatedAt": "2026-07-30T00:00:00Z",
      "source": {
        "provider": "user_decision",
        "reference": "star-map-archive"
      },
      "ownerId": "owner-product",
      "confidence": 1,
      "metadata": {
        "primaryExperience": false
      },
      "confirmedBy": "owner-product",
      "confirmedAt": "2026-07-30T00:00:00Z"
    },
    {
      "id": "evidence-editorial-approved",
      "type": "evidence",
      "title": "Editorial Atlas and Signal Instrument approved",
      "summary": "The editorial and instrument design language is the approved next product direction.",
      "status": "confirmed",
      "createdAt": "2026-07-30T00:00:00Z",
      "updatedAt": "2026-07-30T00:00:00Z",
      "source": {
        "provider": "user_decision",
        "reference": "visual-direction-approval"
      },
      "ownerId": "owner-product",
      "confidence": 1,
      "metadata": {
        "designDirection": "Editorial Atlas × Signal Instrument"
      },
      "confirmedBy": "owner-product",
      "confirmedAt": "2026-07-30T00:00:00Z"
    },
    {
      "id": "claim-datahub-operational",
      "type": "claim",
      "title": "DataHub integration is technically operational",
      "summary": "The bounded DataHub runtime and read-only MCP access path have real verification evidence.",
      "status": "confirmed",
      "createdAt": "2026-07-30T00:00:00Z",
      "updatedAt": "2026-07-30T00:00:00Z",
      "source": {
        "provider": "nexus",
        "reference": "runtime-evidence-synthesis"
      },
      "ownerId": "owner-engineering",
      "confidence": 0.98,
      "metadata": {
        "scope": "local-read-only-foundation"
      }
    },
    {
      "id": "claim-campus-showcase",
      "type": "claim",
      "title": "Campus fixture is suitable for public showcase",
      "summary": "An earlier proposal treated the development fixture as the final Demo scenario.",
      "status": "superseded",
      "createdAt": "2026-07-29T00:00:00Z",
      "updatedAt": "2026-07-30T00:00:00Z",
      "source": {
        "provider": "agent",
        "reference": "earlier-showcase-proposal"
      },
      "ownerId": "owner-product",
      "confidence": 0.2,
      "metadata": {
        "finalDemo": false,
        "developmentFixture": true
      },
      "supersededBy": "decision-no-campus-demo"
    },
    {
      "id": "claim-star-map-primary",
      "type": "claim",
      "title": "Star Map should remain the primary product experience",
      "summary": "An earlier product narrative centered the visual experiment as the main experience.",
      "status": "disputed",
      "createdAt": "2026-07-28T00:00:00Z",
      "updatedAt": "2026-07-30T00:00:00Z",
      "source": {
        "provider": "agent",
        "reference": "earlier-product-narrative"
      },
      "ownerId": "owner-product",
      "confidence": 0.25,
      "metadata": {
        "primaryExperience": false
      },
      "supersededBy": "decision-archive-star-map"
    },
    {
      "id": "claim-continuity-direction",
      "type": "claim",
      "title": "Continuity Engine is the long-term product direction",
      "summary": "Nexus should preserve trustworthy project continuity across time, tools, people, and agents.",
      "status": "confirmed",
      "createdAt": "2026-07-30T00:00:00Z",
      "updatedAt": "2026-07-30T00:00:00Z",
      "source": {
        "provider": "user_decision",
        "reference": "continuity-direction"
      },
      "ownerId": "owner-product",
      "confidence": 1,
      "metadata": {
        "longTermDirection": true
      }
    },
    {
      "id": "decision-no-campus-demo",
      "type": "decision",
      "title": "Campus fixture will not be used in the final Demo",
      "summary": "Keep the low-carbon scenario only as technical development data.",
      "status": "confirmed",
      "createdAt": "2026-07-30T00:00:00Z",
      "updatedAt": "2026-07-30T00:00:00Z",
      "source": {
        "provider": "user_decision",
        "reference": "fixture-boundary"
      },
      "ownerId": "owner-product",
      "confidence": 1,